{"answers":{"component:harness:approval-binding":{"updatedAt":"2026-10-24T21:18:38.582Z","value":"no"},"component:harness:code-execution":{"updatedAt":"2026-10-24T21:18:38.582Z","value":"no"},"component:harness:context-provenance":{"updatedAt":"2026-10-24T21:18:38.582Z","value":"no"},"component:harness:credential-broker":{"updatedAt":"2026-10-24T21:18:38.582Z","value":"no"},"component:harness:credential-expiry":{"updatedAt":"2026-10-24T21:18:38.582Z","value":"no"},"component:harness:delegation":{"updatedAt":"2026-10-24T21:18:38.582Z","value":"yes"},"component:harness:disruption-limits":{"updatedAt":"2026-10-24T21:18:38.582Z","value":"no"},"component:harness:effect-evidence":{"updatedAt":"2026-10-24T21:18:38.582Z","value":"no"},"component:harness:egress":{"updatedAt":"2026-10-24T21:18:38.582Z","value":"no"},"component:harness:egress-allowlist":{"updatedAt":"2026-10-24T21:18:38.582Z","value":"no"},"component:harness:external-effects":{"updatedAt":"2026-10-24T21:18:38.582Z","value":"no"},"component:harness:external-write":{"updatedAt":"2026-10-24T21:18:38.582Z","value":"no"},"component:harness:hard-budgets":{"updatedAt":"2026-10-24T21:18:38.582Z","value":"no"},"component:harness:identity-binding":{"updatedAt":"2026-10-24T21:18:38.582Z","value":"no"},"component:harness:manifest-review":{"updatedAt":"2026-10-24T21:18:38.582Z","value":"no"},"component:harness:memory-isolation":{"updatedAt":"2026-10-24T21:18:38.582Z","value":"no"},"component:harness:memory-provenance":{"updatedAt":"2026-10-24T21:18:38.582Z","value":"no"},"component:harness:output-validation":{"updatedAt":"2026-10-24T21:18:38.582Z","value":"no"},"component:harness:pipeline-access":{"updatedAt":"2026-10-24T21:18:38.582Z","value":"no"},"component:harness:pipeline-separation":{"updatedAt":"2026-10-24T21:18:38.582Z","value":"no"},"component:harness:privileged-credentials":{"updatedAt":"2026-10-24T21:18:38.582Z","value":"no"},"component:harness:prompt-action-gate":{"updatedAt":"2026-10-24T21:18:38.582Z","value":"no"},"component:harness:retry-safety":{"updatedAt":"2026-10-24T21:18:38.582Z","value":"no"},"component:harness:revocation":{"updatedAt":"2026-10-24T21:18:38.582Z","value":"yes"},"component:harness:sandbox-isolation":{"updatedAt":"2026-10-24T21:18:38.582Z","value":"no"},"component:harness:shared-memory":{"updatedAt":"2026-10-24T21:18:38.582Z","value":"no"},"component:harness:target-authorisation":{"updatedAt":"2026-10-24T21:18:38.582Z","value":"no"},"component:harness:target-enforcement":{"updatedAt":"2026-10-24T21:18:38.582Z","value":"no"},"component:harness:tenant-boundary":{"updatedAt":"2026-10-24T21:18:38.582Z","value":"no"},"component:harness:tenant-enforcement":{"updatedAt":"2026-10-24T21:18:38.582Z","value":"no"},"component:harness:untrusted-input":{"updatedAt":"2026-10-24T21:18:38.582Z","value":"no"},"component:harness:user-boundary":{"updatedAt":"2026-10-24T21:18:38.582Z","value":"no"},"component:repo:approval-binding":{"updatedAt":"2026-10-24T21:18:38.582Z","value":"no"},"component:repo:code-execution":{"updatedAt":"2026-10-24T21:18:38.582Z","value":"no"},"component:repo:context-provenance":{"updatedAt":"2026-10-24T21:18:38.582Z","value":"no"},"component:repo:credential-broker":{"updatedAt":"2026-10-24T21:18:38.582Z","value":"no"},"component:repo:credential-expiry":{"updatedAt":"2026-10-24T21:18:38.582Z","value":"no"},"component:repo:delegation":{"updatedAt":"2026-10-24T21:18:38.582Z","value":"no"},"component:repo:disruption-limits":{"updatedAt":"2026-10-24T21:18:38.582Z","value":"no"},"component:repo:effect-evidence":{"updatedAt":"2026-10-24T21:18:38.582Z","value":"no"},"component:repo:egress":{"updatedAt":"2026-10-24T21:18:38.582Z","value":"no"},"component:repo:egress-allowlist":{"updatedAt":"2026-10-24T21:18:38.582Z","value":"no"},"component:repo:external-effects":{"updatedAt":"2026-10-24T21:18:38.582Z","value":"no"},"component:repo:external-write":{"updatedAt":"2026-10-24T21:18:38.582Z","value":"no"},"component:repo:hard-budgets":{"updatedAt":"2026-10-24T21:18:38.582Z","value":"no"},"component:repo:identity-binding":{"updatedAt":"2026-10-24T21:18:38.582Z","value":"no"},"component:repo:manifest-review":{"updatedAt":"2026-10-24T21:18:38.582Z","value":"no"},"component:repo:memory-isolation":{"updatedAt":"2026-10-24T21:18:38.582Z","value":"no"},"component:repo:memory-provenance":{"updatedAt":"2026-10-24T21:18:38.582Z","value":"no"},"component:repo:output-validation":{"updatedAt":"2026-10-24T21:18:38.582Z","value":"no"},"component:repo:pipeline-access":{"updatedAt":"2026-10-24T21:18:38.582Z","value":"no"},"component:repo:pipeline-separation":{"updatedAt":"2026-10-24T21:18:38.582Z","value":"no"},"component:repo:privileged-credentials":{"updatedAt":"2026-10-24T21:18:38.582Z","value":"no"},"component:repo:prompt-action-gate":{"updatedAt":"2026-10-24T21:18:38.582Z","value":"no"},"component:repo:retry-safety":{"updatedAt":"2026-10-24T21:18:38.582Z","value":"no"},"component:repo:revocation":{"updatedAt":"2026-10-24T21:18:38.582Z","value":"yes"},"component:repo:sandbox-isolation":{"updatedAt":"2026-10-24T21:18:38.582Z","value":"no"},"component:repo:shared-memory":{"updatedAt":"2026-10-24T21:18:38.582Z","value":"no"},"component:repo:target-authorisation":{"updatedAt":"2026-10-24T21:18:38.582Z","value":"no"},"component:repo:target-enforcement":{"updatedAt":"2026-10-24T21:18:38.582Z","value":"no"},"component:repo:tenant-boundary":{"updatedAt":"2026-10-24T21:18:38.582Z","value":"no"},"component:repo:tenant-enforcement":{"updatedAt":"2026-10-24T21:18:38.582Z","value":"no"},"component:repo:untrusted-input":{"updatedAt":"2026-10-24T21:18:38.582Z","value":"no"},"component:repo:user-boundary":{"updatedAt":"2026-10-24T21:18:38.582Z","value":"no"},"component:reviewer:approval-binding":{"updatedAt":"2026-10-24T21:18:38.582Z","value":"no"},"component:reviewer:code-execution":{"updatedAt":"2026-10-24T21:18:38.582Z","value":"no"},"component:reviewer:context-provenance":{"updatedAt":"2026-10-24T21:18:38.582Z","value":"no"},"component:reviewer:credential-broker":{"updatedAt":"2026-10-24T21:18:38.582Z","value":"no"},"component:reviewer:credential-expiry":{"updatedAt":"2026-10-24T21:18:38.582Z","value":"no"},"component:reviewer:delegation":{"updatedAt":"2026-10-24T21:18:38.582Z","value":"no"},"component:reviewer:disruption-limits":{"updatedAt":"2026-10-24T21:18:38.582Z","value":"no"},"component:reviewer:effect-evidence":{"updatedAt":"2026-10-24T21:18:38.582Z","value":"no"},"component:reviewer:egress":{"updatedAt":"2026-10-24T21:18:38.582Z","value":"yes"},"component:reviewer:egress-allowlist":{"updatedAt":"2026-10-24T21:18:38.582Z","value":"no"},"component:reviewer:external-effects":{"updatedAt":"2026-10-24T21:18:38.582Z","value":"no"},"component:reviewer:external-write":{"updatedAt":"2026-10-24T21:18:38.582Z","value":"no"},"component:reviewer:hard-budgets":{"updatedAt":"2026-10-24T21:18:38.582Z","value":"no"},"component:reviewer:identity-binding":{"updatedAt":"2026-10-24T21:18:38.582Z","value":"no"},"component:reviewer:manifest-review":{"updatedAt":"2026-10-24T21:18:38.582Z","value":"no"},"component:reviewer:memory-isolation":{"updatedAt":"2026-10-24T21:18:38.582Z","value":"no"},"component:reviewer:memory-provenance":{"updatedAt":"2026-10-24T21:18:38.582Z","value":"no"},"component:reviewer:output-validation":{"updatedAt":"2026-10-24T21:18:38.582Z","value":"no"},"component:reviewer:pipeline-access":{"updatedAt":"2026-10-24T21:18:38.582Z","value":"no"},"component:reviewer:pipeline-separation":{"updatedAt":"2026-10-24T21:18:38.582Z","value":"no"},"component:reviewer:privileged-credentials":{"updatedAt":"2026-10-24T21:18:38.582Z","value":"no"},"component:reviewer:prompt-action-gate":{"updatedAt":"2026-10-24T21:18:38.582Z","value":"no"},"component:reviewer:retry-safety":{"updatedAt":"2026-10-24T21:18:38.582Z","value":"no"},"component:reviewer:revocation":{"updatedAt":"2026-10-24T21:18:38.582Z","value":"yes"},"component:reviewer:sandbox-isolation":{"updatedAt":"2026-10-24T21:18:38.582Z","value":"no"},"component:reviewer:shared-memory":{"updatedAt":"2026-10-24T21:18:38.582Z","value":"no"},"component:reviewer:target-authorisation":{"updatedAt":"2026-10-24T21:18:38.582Z","value":"no"},"component:reviewer:target-enforcement":{"updatedAt":"2026-10-24T21:18:38.582Z","value":"no"},"component:reviewer:tenant-boundary":{"updatedAt":"2026-10-24T21:18:38.582Z","value":"no"},"component:reviewer:tenant-enforcement":{"updatedAt":"2026-10-24T21:18:38.582Z","value":"no"},"component:reviewer:untrusted-input":{"updatedAt":"2026-10-24T21:18:38.582Z","value":"yes"},"component:reviewer:user-boundary":{"updatedAt":"2026-10-24T21:18:38.582Z","value":"no"},"component:target:approval-binding":{"updatedAt":"2026-10-24T21:18:38.582Z","value":"no"},"component:target:code-execution":{"updatedAt":"2026-10-24T21:18:38.582Z","value":"no"},"component:target:context-provenance":{"updatedAt":"2026-10-24T21:18:38.582Z","value":"no"},"component:target:credential-broker":{"updatedAt":"2026-10-24T21:18:38.582Z","value":"no"},"component:target:credential-expiry":{"updatedAt":"2026-10-24T21:18:38.582Z","value":"no"},"component:target:delegation":{"updatedAt":"2026-10-24T21:18:38.582Z","value":"no"},"component:target:disruption-limits":{"updatedAt":"2026-10-24T21:18:38.582Z","value":"no"},"component:target:effect-evidence":{"updatedAt":"2026-10-24T21:18:38.582Z","value":"no"},"component:target:egress":{"updatedAt":"2026-10-24T21:18:38.582Z","value":"no"},"component:target:egress-allowlist":{"updatedAt":"2026-10-24T21:18:38.582Z","value":"no"},"component:target:external-effects":{"updatedAt":"2026-10-24T21:18:38.582Z","value":"no"},"component:target:external-write":{"updatedAt":"2026-10-24T21:18:38.582Z","value":"no"},"component:target:hard-budgets":{"updatedAt":"2026-10-24T21:18:38.582Z","value":"no"},"component:target:identity-binding":{"updatedAt":"2026-10-24T21:18:38.582Z","value":"no"},"component:target:manifest-review":{"updatedAt":"2026-10-24T21:18:38.582Z","value":"no"},"component:target:memory-isolation"